{
  "batch_id": "synthetic-2026-0",
  "feature_schema_version": "routing-features.v1",
  "generated_at": "2026-09-01T23:00:00Z",
  "model_registry": [
    {
      "estimated_input_cost_per_token": 1e-07,
      "estimated_output_cost_per_token": 4e-07,
      "max_context_tokens": 32000,
      "model": "cheap",
      "model_version": "sim-1",
      "provider": "sim",
      "supports_structured_output": true,
      "supports_tools": false
    },
    {
      "estimated_input_cost_per_token": 8e-07,
      "estimated_output_cost_per_token": 3.2e-06,
      "max_context_tokens": 128000,
      "model": "balanced",
      "model_version": "sim-1",
      "provider": "sim",
      "supports_structured_output": true,
      "supports_tools": true
    },
    {
      "estimated_input_cost_per_token": 5e-06,
      "estimated_output_cost_per_token": 2e-05,
      "max_context_tokens": 200000,
      "model": "flagship",
      "model_version": "sim-1",
      "provider": "sim",
      "supports_structured_output": true,
      "supports_tools": true
    }
  ],
  "producer": {
    "repo": "parakh-synthetic-karmi",
    "version": "0.1.0"
  },
  "runs": [
    {
      "attempts": [
        {
          "attempt_id": "att-srun-2026-0-00000-0",
          "currency": "USD",
          "decision_id": "dec-srun-2026-0-00000",
          "error_type": null,
          "estimated_cost": 0.0039504,
          "input_tokens": 2138,
          "latency_ms": 1721.1,
          "model": "balanced",
          "output_tokens": 700,
          "provider": "sim",
          "retry_number": 0,
          "success": true
        }
      ],
      "completed_at": "2026-09-01T00:00:01.721139Z",
      "decisions": [
        {
          "created_at": "2026-09-01T00:00:00Z",
          "decision_id": "dec-srun-2026-0-00000",
          "eligible_models": [
            "sim/balanced",
            "sim/flagship"
          ],
          "exploration": false,
          "feature_schema_version": "routing-features.v1",
          "policy_version": "static-v1",
          "selected_model": "balanced",
          "selected_provider": "sim",
          "selection_probability": 0.85,
          "shadow": false
        }
      ],
      "feature_schema_version": "routing-features.v1",
      "feedback": [],
      "harness_version": "harness-v1",
      "outcome": {
        "completed": true,
        "correction_distance": null,
        "critical_failure": false,
        "currency": "USD",
        "final_cost": 0.0039504,
        "final_latency_ms": 1721.1,
        "finalized_at": "2026-09-01T01:00:00Z",
        "first_shot_success": true,
        "retry_count": 0,
        "structured_output_valid": true,
        "tool_success": true,
        "user_abandon_signal": false,
        "user_accept_signal": false,
        "user_correction_signal": false,
        "user_retry_signal": false
      },
      "policy_version": "static-v1",
      "prompt_version": "prompt-v1",
      "request_id": "req-srun-2026-0-00000",
      "routing_context": {
        "context_utilization_ratio": 0.0167,
        "conversation_depth": 3,
        "estimated_input_tokens": 2138,
        "latency_slo_ms": 10000,
        "previous_tool_failure": false,
        "requires_external_data": false,
        "requires_memory": true,
        "requires_structured_output": true,
        "requires_tools": true,
        "retry_number": 0,
        "task_domain": "support",
        "tier": "trika",
        "tool_count": 2
      },
      "run_id": "srun-2026-0-00000",
      "session_id_hash": "448045b32881e027a4386ec7",
      "started_at": "2026-09-01T00:00:00Z",
      "status": "completed",
      "task_domain": "support",
      "tier": "trika",
      "tool_events": [
        {
          "attempt_number": 1,
          "error_class": null,
          "event_id": "tool-srun-2026-0-00000-0",
          "execution_success": true,
          "latency_ms": 314.0,
          "schema_valid": true,
          "tool_name": "tool_0"
        },
        {
          "attempt_number": 1,
          "error_class": null,
          "event_id": "tool-srun-2026-0-00000-1",
          "execution_success": true,
          "latency_ms": 207.3,
          "schema_valid": true,
          "tool_name": "tool_1"
        }
      ],
      "validation_events": [
        {
          "error_class": null,
          "event_id": "val-srun-2026-0-00000",
          "passed": true,
          "validator": "structured_output"
        }
      ]
    },
    {
      "attempts": [
        {
          "attempt_id": "att-srun-2026-0-00001-0",
          "currency": "USD",
          "decision_id": "dec-srun-2026-0-00001",
          "error_type": "task_failure",
          "estimated_cost": 0.0386272,
          "input_tokens": 45484,
          "latency_ms": 2405.2,
          "model": "balanced",
          "output_tokens": 700,
          "provider": "sim",
          "retry_number": 0,
          "success": false
        },
        {
          "attempt_id": "att-srun-2026-0-00001-1",
          "currency": "USD",
          "decision_id": "dec-srun-2026-0-00001",
          "error_type": "task_failure",
          "estimated_cost": 0.0386272,
          "input_tokens": 45484,
          "latency_ms": 2405.2,
          "model": "balanced",
          "output_tokens": 700,
          "provider": "sim",
          "retry_number": 1,
          "success": false
        }
      ],
      "completed_at": "2026-09-01T00:05:04.810362Z",
      "decisions": [
        {
          "created_at": "2026-09-01T00:05:00Z",
          "decision_id": "dec-srun-2026-0-00001",
          "eligible_models": [
            "sim/balanced",
            "sim/flagship"
          ],
          "exploration": false,
          "feature_schema_version": "routing-features.v1",
          "policy_version": "static-v1",
          "selected_model": "balanced",
          "selected_provider": "sim",
          "selection_probability": 0.85,
          "shadow": false
        }
      ],
      "feature_schema_version": "routing-features.v1",
      "feedback": [],
      "harness_version": "harness-v1",
      "outcome": {
        "completed": false,
        "correction_distance": null,
        "critical_failure": false,
        "currency": "USD",
        "final_cost": 0.0772544,
        "final_latency_ms": 4810.4,
        "finalized_at": "2026-09-01T01:05:00Z",
        "first_shot_success": false,
        "retry_count": 1,
        "structured_output_valid": false,
        "tool_success": null,
        "user_abandon_signal": false,
        "user_accept_signal": false,
        "user_correction_signal": false,
        "user_retry_signal": false
      },
      "policy_version": "static-v1",
      "prompt_version": "prompt-v1",
      "request_id": "req-srun-2026-0-00001",
      "routing_context": {
        "context_utilization_ratio": 0.3553,
        "conversation_depth": 7,
        "estimated_input_tokens": 45484,
        "latency_slo_ms": 4000,
        "previous_tool_failure": false,
        "requires_external_data": true,
        "requires_memory": false,
        "requires_structured_output": true,
        "requires_tools": false,
        "retry_number": 0,
        "task_domain": "source_reasoning",
        "tier": "trika",
        "tool_count": 0
      },
      "run_id": "srun-2026-0-00001",
      "session_id_hash": "391a20989fa6a8604081a635",
      "started_at": "2026-09-01T00:05:00Z",
      "status": "failed",
      "task_domain": "source_reasoning",
      "tier": "trika",
      "tool_events": [],
      "validation_events": [
        {
          "error_class": "schema_invalid",
          "event_id": "val-srun-2026-0-00001",
          "passed": false,
          "validator": "structured_output"
        }
      ]
    },
    {
      "attempts": [
        {
          "attempt_id": "att-srun-2026-0-00002-0",
          "currency": "USD",
          "decision_id": "dec-srun-2026-0-00002",
          "error_type": "task_failure",
          "estimated_cost": 0.0063192,
          "input_tokens": 6699,
          "latency_ms": 1770.8,
          "model": "balanced",
          "output_tokens": 300,
          "provider": "sim",
          "retry_number": 0,
          "success": false
        },
        {
          "attempt_id": "att-srun-2026-0-00002-1",
          "currency": "USD",
          "decision_id": "dec-srun-2026-0-00002",
          "error_type": "task_failure",
          "estimated_cost": 0.0063192,
          "input_tokens": 6699,
          "latency_ms": 1770.8,
          "model": "balanced",
          "output_tokens": 300,
          "provider": "sim",
          "retry_number": 1,
          "success": false
        }
      ],
      "completed_at": "2026-09-01T00:10:03.541547Z",
      "decisions": [
        {
          "created_at": "2026-09-01T00:10:00Z",
          "decision_id": "dec-srun-2026-0-00002",
          "eligible_models": [
            "sim/cheap",
            "sim/balanced"
          ],
          "exploration": false,
          "feature_schema_version": "routing-features.v1",
          "policy_version": "static-v1",
          "selected_model": "balanced",
          "selected_provider": "sim",
          "selection_probability": 0.85,
          "shadow": false
        }
      ],
      "feature_schema_version": "routing-features.v1",
      "feedback": [],
      "harness_version": "harness-v1",
      "outcome": {
        "completed": false,
        "correction_distance": null,
        "critical_failure": false,
        "currency": "USD",
        "final_cost": 0.0126384,
        "final_latency_ms": 3541.5,
        "finalized_at": "2026-09-01T01:10:00Z",
        "first_shot_success": false,
        "retry_count": 1,
        "structured_output_valid": null,
        "tool_success": null,
        "user_abandon_signal": false,
        "user_accept_signal": false,
        "user_correction_signal": false,
        "user_retry_signal": false
      },
      "policy_version": "static-v1",
      "prompt_version": "prompt-v1",
      "request_id": "req-srun-2026-0-00002",